"Title","Genres","Release Date","Release Country","Movie Rating","Review Rating","Movie Run Time","Plot","Cast","Language","Filming Locations","Budget"
"The Owl (2014)"," Drama| Horror| Thriller","1-Jun-14","USA",,6.1,"114 min","Directed by Justin Suttles. With Evan Brinkman, John Dangolli, Ellen Gall, Gina Hughes. The trials of 4 young people who are psychologically tormented by a supernatural entity that takes the form of an owl.","Evan Brinkman|John Dangolli|Ellen Gall|Gina Hughes|Victor Jones|Kenny Logsdon|Jacob Lovett|Heather L. Porter|David Yazdiya","English","Jacksonville, Florida, USA","$5,000 "
"60 Seconds to Die (2016)"," Horror","31-Oct-16","USA",,6.8,,"Directed by Eric Alfonsi, James Balsamo, David Bryant. With Jane Ackermann, Lia Alvarez, Siff Andersson, Shoko Asao. Horror Anthology ""60 second short films that will scar you for a lifetime""","Jane Ackermann|Lia Alvarez|Siff Andersson|Shoko Asao|James Balsamo|Kate Benson|Glenn Berggoetz|Ludovic Berthillot|Brittany Blanton|Stacy Burcham|Shawn Burkett|Annie Burkin|Tony Cabatit|Brian Cacchioli|Sophia Cacciola","English|Spanish","Flint, Michigan, USA",
"407 Dark Flight 3D (2012)"," Horror","22-Mar-12","Thailand","R",4.2,,"Directed by Isara Nadee. With Marsha Wattanapanich, Peter Knight, Paramej Noiam, Patcharee Tubthong. A senior flight attendant named New has to deal with a supernatural event and mystery on the plane when the passengers begin to die one by one.","Marsha Wattanapanich|Peter Knight|Paramej Noiam|Patcharee Tubthong|Anchalee Hassadeevichit|Thiti Vechabul|Namo Tongkumnerd|Sisangian Sihalath|Jonathan Samson|Kristen Evelyn Rossi","Thai|English","Thailand",
"Hell Mountain (2016)"," Horror",2016,"USA",,9.2,"92 min","Directed by Jesse Pomeroy. With Megan Collaso, Taylor Dooley, Markus Innocenti, Catherine Lidstone. A young reporter falls prey to a mysterious ailment after investigating an abandoned house; a place known for tales of missing children and possible cannibalism where local teens dare each other to sneak in and poke around. As the reporter digs deeper and her friends venture out to search the house on their own, she discovers a connection to the legend of Hell Mountain and her own cloudy past.","Megan Collaso|Taylor Dooley|Markus Innocenti|Catherine Lidstone|Adam Daniel Mezei|Colin Woodbury","English",,
"Restraint (2017)"," Horror| Thriller","8-Oct-17","USA",,,"95 min","Directed by Adam Cushman. With Dana Ashbrook, Alex John Borowski, Lauriel Borowski, Stephanie Bullington. A mentally ill woman who's been submerging her violent impulses for years unravels after she marries a controlling older man and relocates to his suburban home.","Dana Ashbrook|Alex John Borowski|Lauriel Borowski|Stephanie Bullington|Isabella Celaya|Shelby Lee Chenard|Caitlyn Folley|Peter Gregg|John Hensley|Ahmad Ibrahim|Christopher Clay Jones|Keely Kapko|Philip T. Nails|Kalpesh Patel|Joseph Pulcino","English",,
"Warning Shadows (1923)"," Drama| Fantasy| Horror| Mystery| Romance","29-Nov-16","Germany","UNRATED",7,"90 min","Directed by Arthur Robison. With Alexander Granach, Max Gülstorff, Lilli Herder, Rudolf Klein-Rogge. A wealthy man invites the local wealthy bachelors over for a puppet show about men who covet another man's wife. The puppeteer is actually a witch and gives the men nightmares about what could happen if they date the lady of the house.","Alexander Granach|Max Gülstorff|Lilli Herder|Rudolf Klein-Rogge|Fritz Kortner|Karl Platen|Fritz Rasp|Eugen Rex|Ferdinand von Alten|Gustav von Wangenheim|Ruth Weyher","German",,
"Reel (2015)"," Horror","4-Oct-15","Canada",,7.5,"79 min","Directed by Chris Good Goodwin. With Mike Estes, Mandy Meyers, Evelyn Komocsi, Chris Brewster. One of the sickest bloodbaths in horror movie history occurs after a deranged stalker becomes obsessed with real life horror film critic Todd Smith.","Mike Estes|Mandy Meyers|Evelyn Komocsi|Chris Brewster|Peter Hodgins|Manfred Dannemann|Stacey Arseneau|Steve Meyers|Gareth Moyse|Anne Shepherd|Matt Sawyers|Tom Goodwin|Matthew Rooney|Carol Kennedy|Andrea Abgrall","English",,
"Sickhouse (2016)"," Horror| Thriller","1-Jun-16","USA","NOT RATED",4,"68 min","Directed by Hannah Macpherson. With Andrea Russett, Laine Neil, Sean O'Donnell, Lukas Gage. A group of teenagers film a live documentary on the Sickhouse legend to millions around the world.","Andrea Russett|Laine Neil|Sean O'Donnell|Lukas Gage|Tacey Adams|Jc Caylen|Danny Belrose|Dominique Columbus|Myron Natwick|Maemae Renfrow|Kayla Servi|Mia Stallard|Emily Osterman|Toni Katano","English",,
"Night of the Babysitter (2017)"," Crime| Horror",2017,"USA",,,,"Directed by Louis Edward Doerge. With Dora Madison, Bill Oberst Jr., Barrington Vaxter, Anthony Cortese.","Dora Madison|Bill Oberst Jr.|Barrington Vaxter|Anthony Cortese|Billy Singhas|Anne Elizabeth Pettit|Kristy Hartsgrove|Michael Xavier Westerfield|W. Allen Anderson|Shunhua Xing|Daniel Hampel|Frances Ann Bottorff|Hunter Ott|Jonathan Horstmann|Taszlin Muerte","English","Iowa City, Iowa, USA",
"The Gateway (2015)"," Horror| Mystery| Sci-Fi","4-Oct-15","USA",,4.8,"74 min","Directed by Jaron Henrie-McCrea. With Danni Smith, Tim Lueke, Martin Monahan, Rick Zahn. A burnt-out ex-nurse in search of a new life moves into a new apartment, but a strange portal in her bathroom wall threatens to destroy any sense of normality.","Danni Smith|Tim Lueke|Martin Monahan|Rick Zahn|Chuck McMahon|Preston C. Lawrence|Gregory Konow|Melissa D. Brown|Robb Coles|Hal Cosec|Anne Denison|Brad Gans|Lew Gardner|Peter Hawn|Jaron Henrie-McCrea","English","New York City, New York, USA",
"Devil's Deal (2013)"," Drama| Horror| Thriller| Western","3-Mar-13","USA","R",2.6,"101 min","Directed by Justin Mosley, Allen Reed. With Mathew Greer, David K. Shelton, Jaysen Dry, Tristan Lavelle. In the town of Burning Bush, the Devil comes to collect the souls he was promised and will destroy anyone or anything that gets in his way.","Mathew Greer|David K. Shelton|Jaysen Dry|Tristan Lavelle|Kari J. Kramer|Allen Reed|Mike L. Hall|Robby Robertson|Michael Chandler|Mark Kellar|James Harris|Shawn Makinson|David Ford|Dan Priest|Cody Pottkotter","English","Upshur County, Texas, USA","$250,000 "
"The Hybrids Family (2015)"," Adventure| Comedy| Family| Horror","1-Oct-16","USA",,7,"95 min","Directed by Tony Randel. With Paul Sorvino, Carolyn Hennesy, Mojean Aria, Philip Willingham. A movie about a dysfunctional family of vampires and witches, it is mostly focused on the two children who are hybrids.","Paul Sorvino|Carolyn Hennesy|Mojean Aria|Philip Willingham|Anne Leighton|Leanne Agmon|Chris De Christopher|Charles Noland|Chuck Ardezzone|Lauren Lakis|Jean St. James|Lee Knorr|Erika Enggren|Rawle D. Lewis|Tatanka Means","English","Florida, USA","$1,500,000 "
"?: A Question Mark (2012)"," Horror| Mystery| Thriller","17-Feb-12","India",,5.5,"82 min","Directed by Allyson Patel, Yash Dave. With Kiran Bhatia, Yaman Chatwal, Maanvi Gagroo, Chirag Jain. A group of friends went to shoot their film project, but never returned. A few days later, their camera was found.","Kiran Bhatia|Yaman Chatwal|Maanvi Gagroo|Chirag Jain|Akhlaque Khan|Sonam Mukherjee|Varun Thakur","Hindi","Imphal, India",
"Ghosts in the Machine (2016)"," Fantasy| Horror| Mystery| Sci-Fi","11-Oct-16","USA",,3.7,"83 min","Directed by Gautier Cazenave. With Florie Auclerc-Vialens, Ruy Buchholz, Morgan Lamorté, Delphine Lanniel. Six young people find an old VCR in an abandoned French house. The machine turns out to be magical... or is it cursed?","Florie Auclerc-Vialens|Ruy Buchholz|Morgan Lamorté|Delphine Lanniel|Isabel McCann|Petur Oskar Sigurdsson","English",,
"The Hospital (2013)"," Horror","15-Feb-13","USA",,2.7,"95 min","Directed by Tommy Golden, Daniel Emery Taylor. With Jim O'Rear, Daniel Emery Taylor, John Dugan, April Monique Burril. Old St. Leopold's Hospital has many urban legends surrounding it, but the residents of Bridgeport all agree on one thing: tortured souls roam its abandoned halls. The mystery proves too much for a pretty young student who decides to investigate for her senior class project. Unfortunately, she does not find ghosts. She, instead, finds Stanley... serial rapist, murderer, and psychopath. As the ...","Jim O'Rear|Daniel Emery Taylor|John Dugan|April Monique Burril|Jason Crowe|Scott Tepperman|Robyn Shute|Alicia M. Clark|Lauryn MacGregor|Megan Hunt|Carlo Alvarez|Melanie Contreras|G. Larry Butler|Christina Schimmel|Amanda Barry","English","South Pittsburg, Tennessee, USA","$100,000 "
"Wrath of the Crows (2013)"," Horror| Mystery| Thriller","2-May-13","USA",,4.2,"87 min","Directed by Ivan Zuccon. With Tiffany Shepis, Debbie Rochon, Tara Cardinal, Domiziano Arcangeli. Wrath of the crows is very gory and brutal, but tied by a strong concept and the whole story is focused on the characters' development. So there's not only splatter sequences, but also atmospheric moments, a few dream-like sequences and a final twist that will shock you all.","Tiffany Shepis|Debbie Rochon|Tara Cardinal|Domiziano Arcangeli|Suzi Lorraine|Michael Segal|Brian Fortune|Gerry Shanahan|Emanuele Cerman|Matteo Tosi|Giuseppe Gobbato|John Game|Carl Wharton|Andreea Togan|Chris Pybus","English","Adria, Rovigo, Veneto, Italy","$500,000 "
"Gulyabani (2014)"," Comedy| Horror","28-Feb-14","Turkey",,3.5,"86 min","Directed by Orçun Benli. With Deniz Ugur, Ceyda Ates, Didem Balçin, Melike Öcalan.","Deniz Ugur|Ceyda Ates|Didem Balçin|Melike Öcalan|Hasan Küçükçetin|Mustafa Üstündag|Orhan Eskin|Sarp Bozkurt|Perihan Savas|Kenan Ece|Cüneyt Arkin|Yunus Güner|Serkan Genç|Merve Oflaz","Turkish",,
"Suite 313 (2017)"," Action| Horror","13-Jul-17","Italy",,6,"63 min","Directed by Aaron Pederis. With Jade Matthew, Roland Stone, Mario Sarri, Pierluigi Nitas. Special Agent Alexander Connor is sent to investigate a house, from which a woman named Sandra has made numerous 911 calls. Things become more complicated than expected for Agent Connor, as he finds he must also rescue a police officer who responded to the home 24 hours earlier. Soon, Agent Connor will discover a horrifying secret; that Sandra is one of LUMEN CORPORATION's donors and has devoted ...","Jade Matthew|Roland Stone|Mario Sarri|Pierluigi Nitas|Livia Paresi|Luisa Fioravanti|Dan Wilder|Maazel Mirko|Samuel Moreni","English",,"  €150,000  "
"Mangkukulob (2012)"," Horror","15-Jul-12","Philippines",,5.6,"120 min","Directed by Ron Sapinoso. With Marvelous Alejo, Bonic Marco.","Marvelous Alejo|Bonic Marco","Filipino","Cavite, Philippines","  PHP 100,000  "
"Kampout: Director's Cut (2016)"," Horror","31-Oct-16","USA",,,,"Directed by Glenn Martin. With Chase Anderson, Jamie Bozian, Devin Broadbent, Rj Bryant. Enraged by the murder of it's offspring, a Bigfoot rampages through the countryside of Southeast Ohio. Detective Benson (Zach Galligan), Ranger Thomas (Johnny Lechner) and Bigfoot researcher Hank (Dave Sherrill) scramble to locate the legendary creature before it attacks a group of teenagers on a camping trip in an isolated place called Kampout.","Chase Anderson|Jamie Bozian|Devin Broadbent|Rj Bryant|Ryan Burch|Zach Galligan|Steffie Grote|Johnny Lechner|Chris Nash|Mackenzie Palma|Madison Palma|Rejeana Palma|Bill Peneston|David Sherrill|Jordan Trovillion","English",,
"Marshrut postroen (2016)"," Horror| Thriller","31-Mar-16","Russia",,4.1,"85 min","Directed by Oleg Assadulin. With Pavel Chinaryov, Svetlana Ustinova, Vitaliya Kornienko, Diana Melison. Contemporary Russia. A young couple finds a great deal on a used BMW. Unfortunately, it's haunted.","Pavel Chinaryov|Svetlana Ustinova|Vitaliya Kornienko|Diana Melison|Kristina Shapovalova|Elizaveta Polyakova|Sergey Safronov|Ilya Safronov|Andrey Safronov|Tatyana Kuznetsova|Ivan Kapitonov|Elena Pashkova|Alla Tsukanova|Ivan Mamonov|Valeriy Markin","Russian",,"  RUR 1,000,000  "
"Armistice (2013)"," Horror| Thriller","7-Jan-14","USA",,4.7,"81 min","Directed by Luke Massey. With Joseph Morgan, Matt Ryan, William Troughton, Al Weaver. A Royal Marine awakens to find himself imprisoned and forced to fight to the death against inhuman opponents again and again.","Joseph Morgan|Matt Ryan|William Troughton","English","Stratford-upon-Avon, Warwickshire, England, UK",
"Inside: A Chinese Horror Story (2017)"," Horror","7-Apr-17","China",,4.9,"89 min","Directed by Lili Bai. With Marc Philip Goodman, Yulai Lu. Cui Kai is a has-been writer and lives in his distressed apartment, unemployed. One day he receives an exciting job offer from an editor-to create a horror series. Kai has finally completed the horror series. The book becomes an immediate hit. However, fame does not make Kai any happier. Every story in his book is inextricably intertwined with his own life. He himself has a personality split and ...","Marc Philip Goodman|Yulai Lu","Chinese",,"$500,000 "
"Exorcism (2014)"," Horror","18-Oct-14","UK",,2.8,"73 min","Directed by Lance Patrick. With Alex Rendall, Aisling Knight, Rick Alancroft, Sarah Akehurst. In 1963 a young woman was possessed by a demon claiming to be the Devil, a local priest was requested by the girl's mother to perform an Exorcism. No one knows what became of them. 50 years later a group of filmmakers attempt to recreate the Exorcism but they are not prepared for the horror they will encounter. Captured on behind the scenes camera we the audience are now able to see these ...","Alex Rendall|Aisling Knight|Rick Alancroft|Sarah Akehurst|Elise Harris|Craig Daniels|Terry Felix|Lee Akehurst|Mike Bracewell|Chloe de Burgh|Tommy Carey|Robert Descartes|Kerry Holland|Simon Mathews|Dita Pesek","English",,
"Fractured (2016)"," Horror| Thriller",2016,"UK",,8.1,"80 min","Directed by Jamie Patterson, Jamie Patterson. With April Pearson, Karl Davies, Louisa Lytton, Jordan Metcalfe. When Rebecca and Michael decide to take a weekend getaway and drive into the isolated countryside, they arrive at their cottage unscathed, but Rebecca can't help but feel like someone is watching.","April Pearson|Karl Davies|Louisa Lytton|Jordan Metcalfe|Calvin Dean","English",,
"Werewolves in Heat (2015)"," Comedy| Horror","8-Dec-15","USA",,5.7,,"Directed by Lance Polland. With Minchi Murakami, Christopher Raff, Ron Jeremy, Mir Waiss Najibi. The small desert town of Death Valley is home to a local Biker gang known as the Legion of Outlaws, an MC who traffic drugs, prostitution and the occasional werewolf attack.","Minchi Murakami|Christopher Raff|Ron Jeremy|Mir Waiss Najibi|Jon Arking|Joseph Bueno|Elias Cecil|Elissa Dowling|Sean Michael Gloria|Paul Gonzales|David C. Hayes|Hans Hernke|Peter Monge|Steven Richards|Matthew Scott","English","Fullerton, California, USA",
"Maya (2015)"," Horror| Thriller","17-Sep-15","India",,7.8,"141 min","Directed by Ashwin Saravanan. With Nayanthara, Aari, Amzath Khan, Lakshmi Priyaa Chandramouli. A woman takes on the challenge of watching a horror film, alone in a theatre.","Nayanthara|Aari|Amzath Khan|Lakshmi Priyaa Chandramouli|Robo Shankar|Mime Gopi|Sharath|Udhayabanu Maheshwaran|Reshmi Menon|G.M. Kumar","Tamil",,
"Una Comedia Macabra (2017)"," Comedy| Horror","21-Sep-17","Peru",,1,"91 min","Directed by Sandro Ventura. With Emilia Drago, Natalia Salas, Adal Ramones, Fiorella Rodriguez. Angela discovers that her boyfriend is unfaithful to her. With lies convinces Jenny, a friend victim of many phobias, to visit a witch expert in voodoo to perform his revenge.","Emilia Drago|Natalia Salas|Adal Ramones|Fiorella Rodriguez|Rodrigo Sánchez Patiño|Gian Piero Díaz|Jessica Cediel|Manolo Rojas|Guillermo Castañeda|Fernando Armas|Alicia Mercado|Junior Silva|Fiorella Luna|Sol Valera|Ximena Hoyos","Spanish","Lima, Lima, Peru","$600,000 "
"Alamet-i Kiyamet (2016)"," Horror","20-May-16","Turkey",,7,"88 min","Directed by Doga Can Anafarta. With Busra Cubukcuoglu, Dogus Gun Demir, Funda Ersin, Muge Esmeray. The movie is actually based upon Roman Polanski's Rosemary's Baby (1968)even though it is not credited.","Busra Cubukcuoglu|Dogus Gun Demir|Funda Ersin|Muge Esmeray|Eda Gürses|Eren Kucuksolakoglu|Murat Onuk|Sedat Savtak|Belgi Saygi|Enis Zeytinler","Turkish",,
"The Shelter (2015)"," Drama| Horror| Thriller","28-Aug-15","UK",,3.8,"76 min","Directed by John Fallon. With Michael Paré, Rachel G. Whittle, Lauren Alexandra, John Fallon. A homeless man named Thomas (Michael Pare) finds shelter for the night within a lavish abandoned two-story house. He eventually discovers that he is not alone and the premises won't let him leave.","Michael Paré|Rachel G. Whittle|Lauren Alexandra|John Fallon|Amy Wickenheiser|Gayle James|Brigette Rose|Thomas Johnston|David M. Lawson","English","Lafayette, Louisiana, USA",
"Dead Nude Girls (2013)"," Horror","15-May-13","Canada",,6.8,,"Directed by Ryan Nicholson. With Carley Anderson, Beka Bootay, Amanda Finnamore, Laura Lay. A man obsessed with bird-watching takes on a new hobby, killing young ladies.","Carley Anderson|Beka Bootay|Amanda Finnamore|Laura Lay|Ryan Nicholson|Erin Young","English","Vancouver, British Columbia, Canada","$100,000 "
"Raaz 3: The Third Dimension (2012)"," Horror| Mystery| Romance| Thriller","7-Sep-12","India","R",4,"139 min","Directed by Vikram Bhatt. With Emraan Hashmi, Bipasha Basu, Esha Gupta, Manish Chaudhary. When an ingénue's sudden popularity threatens to shove her out of the spotlight, a movie star uses black magic in an attempt to derail her career.","Emraan Hashmi|Bipasha Basu|Esha Gupta|Manish Chaudhary","Hindi",,
"Desolation (2017)"," Drama| Horror| Thriller","21-Jun-17","USA",,7.5,"78 min","Directed by Sam Patton. With Toby Nichols, Jaimi Paige, Alyshia Ochse, Claude Duhamel. A mother takes her son and her best friend on a trip into remote wilderness to scatter his father's ashes; they must confront their fears when a lone hiker begins following them.","Toby Nichols|Jaimi Paige|Alyshia Ochse|Claude Duhamel","English","Utica, New York, USA",
"Tales of Poe (2014)"," Fantasy| Horror| Thriller","1-Aug-14","USA",,6.8,"120 min","Directed by Bart Mastronardi, Alan Rowe Kelly. With Caroline Williams, Debbie Rochon, Adrienne King, Amy Steel. Based on the classic works of Edgar Allan Poe - a unique spin on three of Poe's popular stories (The Tell Tale Heart, Cask of Amontillado & Dreams). Directors Bart Mastronardi & Alan Rowe Kelly weave together a compelling and suspenseful anthology that will captivate Poe enthusiasts and horror fans alike!","Caroline Williams|Debbie Rochon|Adrienne King|Amy Steel|Randy Jones|Desiree Gould|Lesleh Donaldson|Alan Rowe Kelly|Brian Dorton|Brewster McCall|Joe Zaso|Michael Varrati|Susan Adriensen|Carl Burrows|Harry Dugan","English","Rockaway Beach, Queens, New York City, New York, USA",
"3 A.M. 3D (2012)"," Horror","22-Nov-12","Thailand",,5.5,"96 min","Directed by Isara Nadee, Kirati Nakintanon, Patchanon Thammajira. With Apinya Sakuljaroensuk, Focus Jirakul, Shahkrit Yamnarm, Ray MacDonald. Thailand's latest horror omnibus is made up of three chilling stories. Two sisters who own a wig shop. A funeral home employee falls in love. Two company directors who love playing scary pranks. Three stories set at 3 AM, the scariest hour of the night, where all spirits are free to roam.","Apinya Sakuljaroensuk|Focus Jirakul|Shahkrit Yamnarm|Ray MacDonald|Toni Rakkaen|Karnklao Duaysianklao|Peter Knight|Vasana Chalakorn|Vivid Bavornkiratikajorn|Nayapak Bhumipak|Thanawat Prasitsomporn|Prachakorn Piyasakulkaew|Kanyarin Nithinoparath","Thai",,
"Dabbe: Cin Çarpmasi (2013)"," Horror","2-Aug-13","Turkey",,7.1,"120 min","Directed by Hasan Karacadag. With Elcin Atamgüc, Mehmet Canbeg, Sabriye Günüç, Sultan Köroglu Kiliç. Preparing for her wedding, Kübra gets possessed by unknown livings. To cure Kübra, a psychiatrist, Ebru, gets on way. Ebru is also an old friend of Kübra. Ebru would work together with an exorcist to save Kübra. Just when things seemed to be going well, everything start going horribly wrong.","Elcin Atamgüc|Mehmet Canbeg|Sabriye Günüç|Sultan Köroglu Kiliç|Oguzhan Kocakli|Cansu Kurgun|Irmak Örnek|A. Murat Özgen","Turkish","Mugla, Turkey",
"The Swimmers (2014)"," Drama| Horror","7-Aug-14","Thailand",,6,"115 min","Directed by Sophon Sakdaphisit. With Chutavuth Pattarakampol, Supassra Thanachat, Thanapob Leeratanakajorn, Violette Wautier. After falling pregnant to Perth, her boyfriend's best friend, Ice commits suicide. She returns to haunt Perth while Tan seeks out the person who made her kill herself for his own revenge.","Chutavuth Pattarakampol|Supassra Thanachat|Thanapob Leeratanakajorn|Violette Wautier","Thai",,
"We All Fall Down (2016)"," Adventure| Drama| Horror| Sci-Fi| Thriller","12-Aug-16","USA",,2.7,"81 min","Directed by Kurt Knight. With David Phillip Fishman, Cardiff Gerhardt, Stephanie Guzman, Mae Veon Johnson. Todd, a haunted young man, runs from the past as he struggles to protect the innocence of Benny, his mute younger brother, in a post apocalyptic world where all the adults have turned into Zombies.","David Phillip Fishman|Cardiff Gerhardt|Stephanie Guzman|Mae Veon Johnson|Ruby Jones|Simon Jones|Chelsea Jurkiewicz|Evey Lindsey|Lex Lindsey|Melissa Mae|Parker Mayberry|Connor James Moore|Robert Nunez|Avery Pizzuto|Bella Pizzuto","English","Utah, USA",
"Mark of Death (2017)"," Action| Fantasy| Horror| Thriller","21-Oct-17","USA","UNRATED",,"80 min","Directed by Matt Spease. With Hailee Mason, Anthony Baker, Ryan Abbott, Caitlyn Bailey. An ex thief and his girlfriend are brutally killed by a group of his former associates. He is then resurrected as a female to exact revenge on their killers.","Hailee Mason|Anthony Baker|Ryan Abbott|Caitlyn Bailey|Matt Spease|Alix Lindbergh|Miracle Davis|Bradley Osborne|Phil Giourousis|Jade Michael LaFont|George W. Bynum|Rick Vyper|Brandon Ferguson|Brian Hardin|John Vasiliou","English","Ward, Arkansas, USA","$2,500 "
"#Slaughterhouse (2017)"," Action| Horror","1-Jul-17","USA",,8.2,,"Directed by Dino Maglaris. With Nicholas Saenz, Shayla Bagir, Karina Clark, David Harrod Jr.. A romantic spring getaway turns sinister when unexpected visitors join the party in a high-tech house that no one can escape.","Nicholas Saenz|Shayla Bagir|Karina Clark|David Harrod Jr.|Grace Marlow|Josh Vinyard|Michael Joplin|Valin Zamarron|Derek Babb|Elizabeth Trieu|Kim Jackson Wheeler|Louie Arnette|Brian Fisher|Zach Rigdon|Jennifer Ekeh","English","Austin, Texas, USA",
"The Mitchell Tapes (2010)"," Horror","29-Sep-17","USA","PG-13",4.9,,"Directed by Thomas S. Nicol. With Joe Estevez, Chuck Lamb, Chelsea Camerlengo, Rick Hills. This found footage horror film is the aftermath of a paranormal investigation gone wrong. The concept of their new reality TV series ""The Ghost Kids"", was to get together a group of teenagers who were more sensitive to paranormal, and then have them investigate the most haunted locations in the country. For the pilot episode they go to Clay County West Virginia, where legend tells that local man ...","Joe Estevez|Chuck Lamb|Chelsea Camerlengo|Rick Hills|Joseph Knapik|Jason Krotky|Dixie Jones|Scott Sheeley|Brian Wolfman Black Bowman|Portia Chellelynn|Brittany Crawford|Breanna Crowell|Twila Diawara|Fox|Ryan Gardener","English","Columbus, Ohio, USA","$6,500 "
"Hollows Grove (2014)"," Horror","21-Oct-14","USA","R",5,"81 min","Directed by Craig Efros. With Mykelti Williamson, Lance Henriksen, Matthew Carey, Sunkrish Bala. A young filmmaker documents his ghost-hunting, reality show friends as their routine investigation of an abandoned orphanage turns into a nightmare from which they can't escape.","Mykelti Williamson|Lance Henriksen|Matthew Carey|Sunkrish Bala|Bresha Webb|Val Morrison|Matt Doherty|Eddie Perez|Gary Sievers|Tanc Sade|Lindsey Smith-Sands|Michael Scott Allen|Haley Lyn Gilchrist","English","Los Angeles, California, USA",
"The Last House on Cemetery Lane (2015)"," Horror","17-Feb-15","USA","NOT RATED",3.5,"82 min","Directed by Andrew Jones. With Lee Bane, Vivien Bridson, Georgina Blackledge, Ian Grey. A screenwriter staying in an old manor house in West Wales discovers that it's haunted by malevolent spirits.","Lee Bane|Vivien Bridson|Georgina Blackledge|Ian Grey|Tessa Wood|Ian Smyth|Kelly Jones",,,
"Exorcism: Haunted Child (2015)"," Drama| Horror","8-May-15","Vietnam",,6.6,"90 min","Directed by Ba Vu Nguyen. With Vinh Anh Ho, Bang Khue Nguyen, Kim Tuyen Tran. The story is about three young people: My Lan, Thien Tam Khuong Duy and the strange, mysterious, and frightening things happening around them.","Vinh Anh Ho|Bang Khue Nguyen|Kim Tuyen Tran","Vietnamese",,
"Shark Week (2012)"," Action| Horror| Sci-Fi","4-Aug-12","USA","TV-14",2.4,"89 min","Directed by Christopher Ray. With Yancy Butler, Patrick Bergin, Joshua Michael Allen, Bart Baggett. A group of complete strangers find themselves isolated by a wealthy madman on his island compound.","Yancy Butler|Patrick Bergin|Joshua Michael Allen|Bart Baggett|Erin Coker|Frankie Cullen|Valerie K. Garcia|Billy Ray|Meredith Thomas|Robert Matthew Wallace|Eric s Wilson|Israel Wright|Josh Williams|John Paul Bennett","English","Eleuthera Island, Bahamas",
"11-12-13 Rak Kan Ja Tai (2016)"," Comedy| Horror","31-Mar-16","Thailand",,6.2,,"Directed by Sarawut Wichiensarn. With Sukollawat Kanaros, Nutthasit Kotimanuswanich, Ramita Mahapreukpong, Mek Mekwattana. 3 Scary stories Occurred during Songkran.","Sukollawat Kanaros|Nutthasit Kotimanuswanich|Ramita Mahapreukpong|Mek Mekwattana","Thai",,
"Chupacabra Territory (2016)"," Horror","1-Mar-16","USA",,6.8,"90 min","Directed by Matt McWilliams. With Sarah Nicklin, Michael Reed, Alex Hayek, Bryant Jansen. The Chupacabra is real and four friends will document it! Will they survive?","Sarah Nicklin|Michael Reed|Alex Hayek|Bryant Jansen|Elliot Book|Donnie Brinker|Megan Hensley|Pierre Kennel|Julianne Tura|Mike Wood",,"Lake Hughes, California, USA",
