"Title","Genres","Release Date","Release Country","Movie Rating","Review Rating","Movie Run Time","Plot","Cast","Language","Filming Locations","Budget"
"Los muertos (2017)"," Horror","1-Sep-17","USA",,,"90 min","Directed by Alfonso Flores Jr.. With Noel Gugliemi, Dyana Ortelli, Philip Friedman, Natalie Ames. The death of a friend, myth of Dia De Los Muertos (Day Of The Dead), disturbing events and paranormal entities intersect with the lives of five friends in this supernatural horror.","Noel Gugliemi|Dyana Ortelli|Philip Friedman|Natalie Ames|Ronnie Alvarez|Vince Romo|Tania Estrada|Sierra Reyes|Matt Nye|Maxie Santillan Jr.|Jaclyn Michelle Snoeberger|Philip De La Rosa|Daniel Casillas|Bianca Monahan|Bill Ibbs","English","Linda Vista Hospital - 610 S. St. Louis Street, Los Angeles, California, USA","$100,000 "
"Area 407: Part Two (2013)"," Horror| Thriller","27-Nov-13","USA",,4,,"Directed by Jay Lee. With Abigail Schrader. Some of the survivors of the plane crash continue to fight for their lives as they are pursued by dinosaurs, a genetically engineered army of zombies, and an array of other terrifying elements and the horrifying government conspiracy unfolds.","Abigail Schrader","English",,"$800,000 "
"Haunted Trailer (2014)"," Comedy| Horror","22-Jul-14","USA",,4.4,"90 min","Directed by Chuck Norfolk. With Ron Jeremy, Joe Grisaffi, Jeremy James Douglas Norton, Jake Byrd. Two goofy hick brothers (Elvis and Aaron), their crazy redneck Momma and sexy sister (Prissy) must exorcise their mobile home of an ancient demon set free to fulfill the 2012 prophecy, with the help of a low rent TV evangelist named Reverend Wiggems, or the world will end. A Raunchy redneck comedy/horror.","Ron Jeremy|Joe Grisaffi|Jeremy James Douglas Norton|Jake Byrd|Lauren Leal|Steve Joseph|Roxy Vandiver|Nick W. Nicholson|Peyton Cottrell II|Danny Gallehugh|Kasey James|Karen Zombora|Amy Rene LaFavers|Elizabeth Redpath|Georgette Trevino","English","Clear Lake, Texas, USA","$100,000 "
"Camp Blood First Slaughter (2014)"," Horror| Thriller","20-May-14","USA",,3.1,"72 min","Directed by Mark Polonia. With Houston Baker, Elizabeth V. Costanzo, Steve Diasparra, Kelsey Kaufmann. A group of students on a class assignment travel to the infamous Camp Blood woods in the hopes of debunking a local legend.","Houston Baker|Elizabeth V. Costanzo|Steve Diasparra|Kelsey Kaufmann|Jeff Kirkendall|Joshua Pollitt|Sarah Ryan|Ken Van Sant|Cindy Wheeler|Ashley Wray","English",,
"The Rooms (2014)"," Horror","27-Mar-14","Thailand",,5.7,,"Directed by Jaded Aueychimplee, Ittisak Eusunthornwattana, Panjapong Kongkanoy. With Markus Waldow, Savika Chaiyadej, Yoko Takano, Kavee Tanjararak. All events take place in rooms. STORY 1 GREEN SONATA is about a lonely violinist whose wife, after an accident, is bedridden. He has promised her undying devotion during courtship, and must now keep his promise. But he has sexual demands as a man and needs to burn off his sexual energy. He finds a willing victim in a virgin who's is having her first working day as a prostitute. The moment he ...","Markus Waldow|Savika Chaiyadej|Yoko Takano|Kavee Tanjararak|Ase Wang|Maythavee Weiss","Thai",,
"Entity (2013)"," Drama| Horror| Thriller","3-Sep-13","USA",,3.6,"107 min","Directed by Mike Yurinko. With Holt Boggs, Brandon Slagle, Nick Mancuso, Frederic Doss. A man deals with the personal tragedy of his family's death by living at the vacation cabin that they last stayed at. He soon discovers he's not alone.","Holt Boggs|Brandon Slagle|Nick Mancuso|Frederic Doss|Emma Waldron|Natalie Makenna|Jena Waldron","English","Lake Ariel, Pennsylvania, USA","$200,000 "
"Sledge (2014)"," Horror","2-Sep-14","USA","NOT RATED",4.6,"75 min","Directed by John B Sovie II, Kristian Hanson. With Dustin Bowman, Rachel Cornell, Tino Faygo, Kristian Hanson. Sledge hits you from the beginning with humor and originality. Opening with Assly's True American Horror television program, the action kicks off instantly with skull crushing deaths from the killer, Adam Lynch. Adam believes he is in a movie and video game that he has created in his head.","Dustin Bowman|Rachel Cornell|Tino Faygo|Kristian Hanson|Mary Hanson|Travis Hanson|Desiree Holmes|Russell Matoes|Troy Miller|Wendy Miller|Stephanie Tupper","English","South Colton, New York, USA",
"Marianne (2011)"," Drama| Fantasy| Horror| Thriller","3-Jul-13","USA","NOT RATED",4.9,"103 min","Directed by Filip Tegstedt. With Thomas Hedengran, Peter Stormare, Tintin Anderzon, Sandra Larsson. After the death of his beloved wife a man begins to fall apart mentally, having dreadful nightmares and finding his family and career affected. As time goes on, he begins to rapidly slip away.","Thomas Hedengran|Peter Stormare|Tintin Anderzon|Sandra Larsson|Dylan M. Johansson|Viktoria Sätter|Helena Löwenmark|Gudrun Mickelsson|Patrik Andersson|Maria Bergsten|Peter Boija|Jonathan Bonin|Stella Edling|Kerstin Hansson|Tim Netzler","Swedish","Östersund, Jämtlands län, Sweden","  SEK 1,000,000  "
"Red Christmas (2014)"," Horror","9-Dec-14","USA",,6.1,"60 min","Directed by Steve Rudzinski. With Seth Gontkovic, Amie Wrenn, Shawn Shelpman, Steve Rudzinski. I'm Tara, I like killing people! I've been doing it a long time now and realized there might be some folks that want to see what it's like. So I made this movie to show you all of the steps of how to brutally murder a person while never forgetting what the holidays are all about! This year, I'm dreaming of a Red Christmas!","Seth Gontkovic|Amie Wrenn|Shawn Shelpman|Steve Rudzinski","English","Morgan, Pennsylvania, USA",
"Psychotic (2012)"," Action| Horror| Thriller","3-Mar-15","USA","TV-14",3.9,"80 min","Directed by Johnny Johnson. With Jenna Verdicchio, Steve Hope Wynne, Kristina Dargelyte, Rosie Cochrane. A psychologist is trapped inside a mental institution where all the patients have escaped and are on the rampage.","Jenna Verdicchio|Steve Hope Wynne|Kristina Dargelyte|Rosie Cochrane|David Aldridge|Adam Lewis|Mark Carlisle|Daniel Godward|Tzvet Lazar|Jodyanne Richardson|Rodolfo Coloma|David Alexander|Libby Braidwood|Natalie Bueza|James Gannon","English","Gosport, Hampshire, England, UK","  £2,000,000  "
"Death-Scort Service Part 2: The Naked Dead (2017)"," Horror","7-Apr-17","USA",,5.2,,"Directed by Sean Donohue. With Krystal Pixie Adams, Bob Glazier, 'Sushi' Xhyvette Holder, Katie McKinley. Deep in the heart of Las Vegas a new killer has emerged. Having survived the previous psycho's last wrath (Michelle) Krystal ""Pixie"" Adams is left behind to start anew and forget about her black past. Problem is this new murderer is unstoppable!!. A new group of up and coming hookers are on the streets left to pick up the pieces and start fresh. Will they survive, or will they become prey to this...","Krystal Pixie Adams|Bob Glazier|'Sushi' Xhyvette Holder|Katie McKinley|Eight The Chosen One|Jules Sceiro|Miss Gia Love|Manda Micro|Stephanie Jensen|Erika Faith Lindbloom|Lucretia Lynn|Nadia White|Pete Girard|Greg G. Freeman|Kelly Helen Thompson","English",,"$2,500 "
"Fly on the Wall (2017)"," Action| Crime| Horror| Thriller","27-Jun-17","USA",,,"89 min","Directed by Michael R. Morris. With Brian Combs, David Danipour, Terence Tierney, Rich Sands. A young man uses a bug camera to spy on his ex-girlfriend, then witnesses her abduction.","Brian Combs|David Danipour|Terence Tierney|Rich Sands|Patrick Mark Turner|Abby Relic|Bridget Albaugh|Brando Abro|Kyle Eastman|Larry L Andrews|Mohammed Bardi|April Eaton|John Gura|Robert Hector|Josephine Hies","English",,
"Night People (2015)"," Horror| Sci-Fi| Thriller","9-May-16","USA",,4.3,"108 min","Directed by Gerard Lough. With Michael Parle, Nigel Brennan, Claire Blennerhassett, Sarah Louise Carney. A pair of professional but mismatched criminals break into a house with a dark past that is about to make its presence felt. Their story soon intertwines with two other sinister tall tales.","Michael Parle|Nigel Brennan|Claire Blennerhassett|Sarah Louise Carney|Aidan O Sullivan|Eoin Leahy|Kieran Kelly|Michael McLaughlin|Philip Doherty|Andrew Norry|Damian Gallagher|Daria Kalista|Derek O'Sullivan|John D. Ruddy|Shane Brohan","English","County Donegal, Ireland","  €1,000,000  "
"Hi5teria (2012)"," Horror| Mystery","29-Mar-12","Indonesia",,6.9,"94 min","Directed by Harvan Agustriansyah, Billy Christian, Adriyanto Dewo. With Tara Basro, Bella Esperance, Egy Fedly, Kriss Hatta.","Tara Basro|Bella Esperance|Egy Fedly|Kriss Hatta|Dinda Kanyadewi|Luna Maya|Ichi Nuraini|Maya Otos|Poppy Sovia|Imelda Therinne|Sigi Wimala|Dion Wiyoko","Indonesian",,
"The Ungovernable Force (2015)"," Action| Adventure| Comedy| Horror| Sci-Fi| Thriller","1-Jan-15","USA",,6.5,"101 min","Directed by Paul M McAlarney. With Tony Moran, Lloyd Kaufman, Debbie Rochon, Diane Pimentel.","Tony Moran|Lloyd Kaufman|Debbie Rochon|Diane Pimentel|Lin Hultgren|Apache Ramos|Arthur Hiou|Shend|Bill Weeden|Nic Cramer|Brian Douglas Young|Renee Mandrake|Graham King|Richard Chandler|Aurora Grabill","English",,"$20,000 "
"Lebuhraya Ke Neraka (2017)"," Drama| Horror","4-May-17","Malaysia",,,"83 min","Directed by Mamat Khalid. With Awie, Khir Rahman, Shahz Jaszle, Dazrin Kamarudin. Lebuhraya Ke Neraka tells a story of a rowdy group of bikers who make a stop by the side of the road and very soon all of them, with the exception of Bob, mysteriously fall ill.","Awie|Khir Rahman|Shahz Jaszle|Dazrin Kamarudin|Miera Leyana|Fatin Syahirah|Rozita Busu|Pekin Ibrahim|Lan Muar","Malay",,
"Test Group (2015)"," Drama| Horror","1-Jan-15","USA",,4.8,"163 min","Directed by David B. Goodwin, Ginger Paige, Albert Roberts. With Amy Allyson Oliver, Jared Allman, Krissy Notes, Brendon Earp. An EPIC zombie film that explains HOW the infection starts... raw, gritty indie film by and starring real-life veterans!","Amy Allyson Oliver|Jared Allman|Krissy Notes|Brendon Earp|Ondie Daniel|Jayson Cross|Denise Bailey|Jeffery James Bucchino|James Wojnowski|Cameron Campbell|Chase Wainscott|Catie Heeter|Eric Rick Kline|Robert Jones|Christa Beth Campbell","English","Atlanta, Georgia, USA","$35,000 "
"Headless (2014)"," Drama| Horror| Thriller","22-Aug-14","USA","NOT RATED",5.9,"71 min","Directed by Toby Lawrence. With Emily Jackson, Brecht Andersch, Brett Mann, Will Manning. After her twin sister is accused of witchcraft and beheaded by a fanatical religious cult, a young woman walks the razor sharp edge between myth and reality seeking the truth, hoping not to lose her head in the process.","Emily Jackson|Brecht Andersch|Brett Mann|Will Manning|Thomas Poole|John Mounier|Christopher Campbell|Kevin Molohan|Patrick Ford|Erin Lawrence|Zoe Raines|Jenna Nuesse|Vanessa Hernandez","English",,
"She's Allergic to Cats (2016)"," Comedy| Horror| Romance","18-Jun-16","USA",,6.4,"82 min","Directed by Michael Reich. With Mike Pinkney, Sonja Kinski, Flula Borg, Veronika Dash. A dog groomer in Hollywood aspires to be more than a dog groomer in Hollywood. Michael Pinkney is a man struggling with his lower income lifestyle in the shadow of the film industry. His job is degrading, his home is infested with rats and his mind constantly wanders into a lo-fi dreamscape that mirrors his analog video experiments. Michael's menial routine spirals out of control when he meets ...","Mike Pinkney|Sonja Kinski|Flula Borg|Veronika Dash|Honey Davis|Mike Dazé|Felipe Esparza|Luis Fernandez-Gil|Willis Jackson|Tom Kiesche|Livia Treviño|Mike Zehr","English","Los Angeles, California, USA",
"Gehenna: Darkness Unleashed (2015)"," Horror","25-Oct-15","USA",,,"120 min","Directed by Kazarr. With Dave Fairbanks, Marcus Murphy, Lauren Cash, Akiba Robinson. The horror/suspense thriller feature film GEHENNA opens with an intense scene where a large man is running through the dark woods while screaming. As he approaches an abandon old garage out of the fog and darkness an unseen image(Antagonist) ascends from beneath the fog. Within a minute he over powers the large man who desperately try's to escape from being pulled into the darkness. Three days ...","Dave Fairbanks|Marcus Murphy|Lauren Cash|Akiba Robinson|W. Keith Scott|Reese Langlois|Barry Battle|Tasha Nwude|Kazarr|Brilliance Hall|Antwane Carson|Therron Dumas|Marissa Carioscia|Caleb J. Jackson|Tasha Wooday","English","Brandywine, Maryland, USA","$15,000 "
"Hana-Dama: The Origins (2014)"," Horror","18-Jan-14","Japan",,5.5,,"Directed by Hisayasu Satô. With Tomori Abe, Shun Asada, Kei Fujiwara, Daisuke Iijima. Transfer student Mizuki is bullied mercilessly by her classmate. Nevertheless, she is always able to maintain her composure. Kirie, who is also bullied, becomes interested in Mizuki and longs for her. The two become close.","Tomori Abe|Shun Asada|Kei Fujiwara|Daisuke Iijima|Kôichi Imaizumi|Masayo Itô|Yuki Kondô|Akie Maruyama|Eriko Nakamura|Rina Sakuragi|Maika Shimamura|Tarô Suwa|Tei Tomari","Japanese",,
"Socialistický Zombi Mord (2014)"," Horror","25-Apr-14","Slovakia",,6,"94 min","Directed by Rastislav Blazek, Peter Cermak, Zuzana Paulini. With Boris Bitukov, Viktor Gschweng, Hanka Harencarova, Peter Levay. Failed Russian experiment gone horribly wrong is brought to Czechoslovakia during the 1968 invasion and forgotten about. Some 15 years later the gas is accidentally released in a Slovak school turning the students into bloodthirsty zombies.","Boris Bitukov|Viktor Gschweng|Hanka Harencarova|Peter Levay|Denisa Rotlingova|Veronika Valentovicova|Tibor Zvonar","Slovak","Slovakia","  €20,000  "
"A Touch Unseen (2014)"," Horror","1-May-14","USA","NOT RATED",5.2,"82 min","After a fatal car accident that kills their parents , two sisters start to notice strange paranormal assaults at night. Things take a worse turn when a stalker becomes interested in the younger sister.",,,,
"Air terjun pengantin phuket (2013)"," Horror| Thriller","31-Jan-13","Indonesia",,5.4,"83 min","Directed by Rizal Mantovani. With Tamara Blezinski, Darius Sinathrya, Kimberly Ryder, Udeh Nans.","Tamara Blezinski|Darius Sinathrya|Kimberly Ryder|Udeh Nans|Putri Una|Stefan William|Laras Monca|Edward Akbar|Ray Sahetapy","Indonesian",,
"Like a Bat Outta Hell (2013)"," Drama| Horror| Thriller","27-May-15","Philippines","NOT RATED",4.2,"92 min","Directed by Danial Donai. With Vernon Wells, Rachael Murphy, Marco Dapper, Dan Balcaban. A young group of avid documentary film makers are sent to shoot in the vast extremes of the South Australian wilderness. They end up in a place called Nowhere Else. What transpires there is devastatingly, like nothing else on Earth.","Vernon Wells|Rachael Murphy|Marco Dapper|Dan Balcaban|William Wensley|Di Lesson|John Reynolds|Sue Broberg|Lovlee Carroll","English",,"  AUD 5,500,000  "
"Aaaah (2014)"," Adventure| Horror| Thriller","28-Nov-14","India",,5.7,"138 min","Directed by Haresh Narayan, K. Hari Shankar. With Gokulnath, Bobby Simha, Meghna, Bala Saravanan. Three friends meeting on their reunion are being drawn into a bet to prove the presence of ghosts by a rich schoolmate unexpectedly, leading them to a journey to five different places around the world suspected to be haunted.","Gokulnath|Bobby Simha|Meghna|Bala Saravanan|Srijith P.S.|Ashokan|S.S. Thalabathi|Monisha|T. Ramesh|Iqbal|Elaya Prasad|Priya|Hussain Jamal|Gowri Shankar|Nori","Tamil","AVM Studios, Chennai, Tamil Nadu, India",
"Mohini (2017)"," Horror",2017,"India",,,,"Directed by R. Madhesh. With Dilyana Bouklieva, Trisha Krishnan, Elena Valdameri, Matt Townsend.","Dilyana Bouklieva|Trisha Krishnan|Elena Valdameri|Matt Townsend|Jackky Bhagnani|Jangiri Madhumitha|Suresh|Shenturan|Ganeshkar|Poornima Bhagiyara","Tamil","Leicester Square, London, England, UK",
"The Midnight Matinee (2017)"," Horror| Mystery| Thriller","19-May-17","USA",,6.5,"46 min","Directed by Justin Doescher. With Maggie Tehan, Justin Doescher, Juan-Pablo Veizaga, Shaun Woodland. Welcome ladies and gentlemen to The Midnight Matinee. You will be entertained by five stories of deceit, deception, and of course.......horror. So enter if you dare. And sit back, relax, and enjoy the show.","Maggie Tehan|Justin Doescher|Juan-Pablo Veizaga|Shaun Woodland|Ian Flanders|Melissa Merry|Aggie Binkley|Maggie Binkley|Becky Edwards|Jimmy Edwards|Sophie Edwards|Heather Masters|Jennifer McCormick|Santiago Veizaga","English","Maryland, USA",
"House of Whores (2015)"," Horror","1-Jul-15","USA",,7.5,"55 min","Directed by Paul Arnone, Tom Komisar, Daniel Murphy. With Tom Komisar, Daniel Murphy, Paul Arnone, R.J. Cecott. Three beauties who would do anything for stardom. Three masked maniacs hellbent for kicks and an insatiable lust for young flesh.","Tom Komisar|Daniel Murphy|Paul Arnone|R.J. Cecott|Linda Schrader|Maella Cai Vane|Lindsey McIntire|Nurse Hatchet","English","Winamac, Indiana, USA","$1,000 "
"Realm of Souls (2013)"," Horror","27-Sep-13","USA",,4.5,"118 min","Directed by Chase Smith. With Lance Paul, Ella Bardine, Jon Bailey, Chase Smith. Last year, a group of filmmakers set out to investigate 13 of the most haunted locations in Georgia in order to gather footage of the supernatural for use in their next horror film. They would never return... What they unleashed was the evil that lies deep within an ancient site of unholy terror ever-looking for a way to escape. Lead by Chase, their director and owner of the Production Company ...","Lance Paul|Ella Bardine|Jon Bailey|Chase Smith|Jacob Williams|Amber Erwin|Teal Haddock|Zoe Myers|Blake Ivey|Katie Blackburn|Rebecca Thomason|Brian Kurtis|K.J. Bump|Jessica Schmahl|Kate Wasiele","English","Atlanta, Georgia, USA",
"The Slayers (2015)"," Comedy| Horror",2016,"UK",,9,"101 min","Directed by John Williams. With Darren McAree, Matthew Sandland, George Newton, Sophie Elsby. Two cult members, Nigel and Job, decide to go on a road trip during their last two weeks on earth. Bucketlist in hand, motorhome fired up, the two head for the mountains of Scotland for a final fortnight filled with girls, skydiving, camping, alcohol and strange men claiming to be vampire slayers... Is this God's plan for Nigel and Job?","Darren McAree|Matthew Sandland|George Newton|Sophie Elsby|Dan Smith|Marnix Van Der Kraan|Pete Bennett|Darren Anstey|Brooklyn Baker|Mark Carter|Jason Conway|Kate Cubley|Colin Dmitri|Tim Edwards|Martin Elliot","English","Burslem, Stoke-on-Trent, Staffordshire, England, UK","  £100,000  "
"The Jokesters (2015)"," Comedy| Horror| Thriller","21-Jul-15","USA",,5.2,"70 min","Directed by AJ Wedding. With Lyndsi LaRose, Luis Jose Lopez, Nathan Reid, Ryan Ryans. Four friends prank a Cabin in the Woods nightmare on their friend's honeymoon so well that it actually becomes The Cabin in the Woods horror in real life.","Lyndsi LaRose|Luis Jose Lopez|Nathan Reid|Ryan Ryans|Dante Spencer|Sandra Stone|Gabriel Tigerman|Jen Yeager","English",,
"Silent Night, Bloody Night 2: Revival (2015)"," Horror","15-Mar-15","USA","NOT RATED",3.5,"90 min","Directed by Dustin Ferguson. With Julia Farrell, Luc Bernier, Jennifer Runyon, Pete Lipins. After a death in the family, siblings Angelica and James Zacherly travel to the small town of East Willard on Christmas Eve to pay their respects. They stay at a homely bed and breakfast where they learn the legend of Black Peter, Santa Claus' vengeful brother. But when they find the lost journal of Jeffrey Butler, they discover the town has its own sordid history - one more rooted in reality.","Julia Farrell|Luc Bernier|Jennifer Runyon|Pete Lipins|Jennii Caroline|Jeanne Kern|Rich Kern|Chad Haufschild|Jarad Allen|Breana Mitchell|Jeff Dylan Graham|Mike Crawford|Sarah Moshman|Kia Beason|Rikki Wallace","English","Nebraska, USA",
"The Devils Door (2016)"," Horror","20-May-16","USA",,8.2,,"Directed by Gordon Price. With Shawn Biery, Joanna Burke, Billy Obryen Cobb, Ricky D'Alonzo. More mystery and ghoulish behavior from the crew at chapter 11, Detective young is at it again in this follow up to Gordy price's( the Watermen,Tyler Perry's Good Deeds) Directorial debut in 2013 ""Music store Massacre"" Young follows clues to capture who or what is behind a series of brutal murders and finds there is something more going on than your typical run of the mill serial killer","Shawn Biery|Joanna Burke|Billy Obryen Cobb|Ricky D'Alonzo|Kyle Douthy|Leo Jaramillo|Alex Michalos|Gordon Price|Deanna Quintana|DeAnna Garcia Quintana|James Shiels III|Chelsia Simmons|Malik Big Leak Smith|Jenn Sparx|Johnny Trash","English","Virginia, USA","$10,000 "
"No 46 (2016)"," Horror","28-Feb-16","Australia",,4.4,,"Directed by Ariana Kenny. With Deborah Joyce, Gerard Holland, Sarah Ann Wiles, Jack Marsden. ELISE is a young, fearful woman who escapes her old life to move in with her best friend Miranda across the country following an altercation with a stalker leading to the death of her boyfriend. They find refuge in Malachai's home, a site that saw a serial killer's murder spree several decades earlier. Though not a superstitious person, Elise begins to encounter strange events that begin to test ...","Deborah Joyce|Gerard Holland|Sarah Ann Wiles|Jack Marsden|Eddy Price|Evangeline Alvarez|Therese Antoun|Brooke Beverley|Amelia Buggiere|Winnie Chong|Charles Clarke|Georgina Clarke|Rebecca Clarke|Christopher Collins|Johnathan Leigh Collins","English","Bankstown, Sydney, New South Wales, Australia","  AUD 5,000  "
"Vampire Clay (2017)"," Horror","21-Sep-17","USA",,5.9,"80 min","Directed by Sôichi Umezawa. With Ena Fujita, Asuka Kurosawa, Yuyu Makihara, Ryô Shinoda. A plasticine demon devours the denizens of a rural art school.","Ena Fujita|Asuka Kurosawa|Yuyu Makihara|Ryô Shinoda|Momoka Sugimoto|Kyôka Takeda|Kanji Tsuda","Japanese",,
"In April (2016)"," Action| Drama| Fantasy| Horror| Thriller","1-Apr-16","USA",,8.5,"119 min","Directed by Carlo Bruno. With Lily Blane, Carlo Bruno, Marina Bruno, Michael Earle Caza. A man drives away from home waiting for that moment to opt for suicide. On the verge of insanity, he discovers a strange travel companion. Catchphrase: ""The Road to Suicide is a Hell of a Thing""","Lily Blane|Carlo Bruno|Marina Bruno|Michael Earle Caza|Anastasia Kimmett|Ian McEachern|Sylvain Morin|Nedra Nash|Howard Perry|Chris Urquhart","English",,"$80,000 "
"Dead Stop (2011)"," Horror","17-Jan-16","USA",,6.1,"82 min","Directed by Jonas Stolpe. With Cathy Baron, Jon Briddell, Erin Campbell, Sarah Flannery. The desert can be an unforgiving place. By day, the temperatures soar past the century mark, hot enough to drop a man in his tracks, and by night they plummet low enough to freeze the life out of him. It is filled with wildlife, feral and deadly. It is not a place where you want to get lost. Unfortunately, Todd and Josh and their friends have done exactly that. On their way to a ski trip, the ...","Cathy Baron|Jon Briddell|Erin Campbell|Sarah Flannery|Brittney Krasts|Devin Leigh|Nikki McKenzie|Brian Ramian|Michael Rupnow|Nikolai Stolpe|Nate Wayman","English",,
"Ridge War Z (2013)"," Horror| Thriller| War","5-Nov-13","USA","TV-MA",2.8,"89 min","Directed by Alek Gearhart. With Dominique Marsell, Travis O'Leary, Kyle Gordon, Dane O'Leary. The last surviving veterans of the worst battle of a zombie war recount their horrific memories to an author who is writing a book about their experiences.","Dominique Marsell|Travis O'Leary|Kyle Gordon|Dane O'Leary|Will Le Fevre|Manuel Eduardo Ramirez|Tyler Allen|Alek Gearhart|Andrew Jackson|Eoin Hartel","English",,"$1,000 "
"Raichi Hikari kurabu (2015)"," Comedy| Horror| Thriller","13-Feb-16","Japan",,6,,"Directed by Eisuke Naitô. With Kisetsu Fujiwara, Yûki Furukawa, Junya Ikeda, Shôtarô Mamiya. Nine pretty boys resist becoming ugly adults, building a robot with human intelligence to help them achieve world domination and kidnap a beautiful girl. As their robot learns what it means to be human, it's creators lose their humanity.","Kisetsu Fujiwara|Yûki Furukawa|Junya Ikeda|Shôtarô Mamiya|Reiya Masaki|Ryô Matsuda|Shûhei Nomura|Amane Okayama|Junki Tozuka","Japanese",,
"Untitled (2011)"," Comedy| Drama| Horror","23-Jan-15","UK",,5.2,,"Directed by Shaun Troke. With Danny Goldberg, Nikki Harrup, Shaun Troke, Leonora Lim-Moore. A filmmaker, his girlfriend, his female colleague, and their rich Producer are to spend a weekend making a documentary within an isolated haunted cottage in Wales.","Danny Goldberg|Nikki Harrup|Shaun Troke|Leonora Lim-Moore|Holly Kenyon|Steve Purbrick|Paul Fields|Laurence Patrick","English","London, England, UK","  £2,000  "
"Andrey Iskanov's Visions of Suffering: Uroboros (2016)"," Horror",2016,"Sweden",,7.9,,"Directed by Andrey Iskanov. With Anastasia Asafova, Harry Bromley Davenport, Tatyana Grehova, Nadejda Gutnikova.","Anastasia Asafova|Harry Bromley Davenport|Tatyana Grehova|Nadejda Gutnikova|Svyatoslav Iliyasov|Andrey Iskanov|Manoush|Victoria Smolajo|Lena Vidal|Mariya Zakharova","Russian","Khabarovsk, Russia",
"Mythily Veendum Varunnu (2017)"," Horror","21-Jul-17","India",,3.2,"94 min","Directed by Sabu Varghese. With Kiran Raj, Shivani, I.M. Vijayan. After losing her father, a girl takes up the responsibility of her mother. She then moves to the city in search of a job. Upon getting the job, her job takes her to a bungalow, where she is subject to a series of horrible situations.","Kiran Raj|Shivani|I.M. Vijayan","Malayalam",,
"The Possessed (2016)"," Horror","23-Jul-16","China",,6.9,"110 min","Directed by Kai Ma. With Tianwen Dong, Jia He, Shuda Zhao, Zhongxue Wen. Two teenagers goes to the countryside to investigate the world of fortune-telling.","Tianwen Dong|Jia He|Shuda Zhao|Zhongxue Wen|Yuan He","Chinese",,
