"Title","Genres","Release Date","Release Country","Movie Rating","Review Rating","Movie Run Time","Plot","Cast","Language","Filming Locations","Budget"
"Sumpahan kum kum (2012)"," Horror","26-Jan-12","Malaysia",,8.9,"88 min","Directed by Ismail Bob Hasim. With Fezrul, Puteri Mardiana, Abdul Razak Ahmad, Echa.","Fezrul|Puteri Mardiana|Abdul Razak Ahmad|Echa|Maimon Mutalib|Kazaar Saisi","Malay",,
"Five Nights at Freddy's: The Fan Film (2016)"," Animation| Drama| Horror","13-Sep-16","USA","NOT RATED",7,,"With Marco Goulart, Cory Leitzel, Shyera Schroepfer, Patrick Delva. A chain of family pizza restaurants faces a number of accusations and mystery from visitors being attacked to fires. Mike, Jeremy, and Zeke find themselves tangled in among the triad of menacing locations, leaving them to figure out the truth behind what has really been taking place.","Marco Goulart|Cory Leitzel|Shyera Schroepfer|Patrick Delva|Justin Cabanting|Dylan Ingram|Thomas Gnyzio|Cameron Skeith|Jun Lai|Nadia Poppen|Lucy Hernandez","English","Portugal",
"Accidental Exorcist (2016)"," Horror","24-Jun-16","USA","TV-MA",4.1,,"Directed by Daniel Falicki. With Daniel Falicki, Faye Sills, Sherryl Despres, David Higbee. Fate has dealt Richard Vanuck a very strange hand; he's a natural born exorcist. In fact, he's the best there's ever been, and with possessions on the rise across the city he's booked solid. Eventually he comes to realize that performing exorcisms is the only thing he's truly good at, even though his daily battles with Satanic forces are wearing him down. ""Riveting, a master piece."" - Awesome Mag...","Daniel Falicki|Faye Sills|Sherryl Despres|David Higbee|Michael McCallum|Joel Potrykus|Kara Joy Reed|James Harris|Julianne Howe-Bouwens|Lajanae Smith|Michael Cunningham|Mary Brown|Heath Scarbrough|Shelley Irwin|Patrick Hendren","English","Grand Rapids, Michigan, USA",
"Adi Kapyare Kootamani (2015)"," Comedy| Horror","25-Dec-15","India",,6.2,"131 min","Directed by John Varghese. With Dhyan Sreenivasan, Mukesh, Namitha Pramod, Aju Varghese. The story revolves around a bunch of college students when a young woman gets stuck inside the boys hostel with no way out.","Dhyan Sreenivasan|Mukesh|Namitha Pramod|Aju Varghese|Neeraj Madhav|Vineeth Mohan|Devi Ajith|Bijukuttan|Disney James|Pradeep Kottayam|Krishnan|Bhagath Baby Manuel|Roshan Mathew|Valsala Menon|Tharikida Sabu","Malayalam",,
"The Black Water Vampire (2014)"," Horror| Mystery| Thriller","21-Jan-14","USA","UNRATED",4.2,"82 min","Directed by Evan Tramel. With Danielle Lozeau, Andrea Monier, Anthony Fanelli, Robin Steffen. A documentary film crew investigates a series of brutal killings known as the Black Water murders. As they delve deeper into the story they stumble upon a horrifying secret, one that they may not survive.","Danielle Lozeau|Andrea Monier|Anthony Fanelli|Robin Steffen|Bill Oberst Jr.|Emma Anderson|Myles Cranford|Fisher David|Brandon deSpain|William Ferguson|Justin Ferrari|David George Fischer|Bob Greenan|Brad Harris|Lynda Lacayo","English","Big Bear Lake, Big Bear Valley, San Bernardino National Forest, California, USA",
"Blood-C: The Last Dark (2012)"," Animation| Action| Adventure| Fantasy| Horror| Mystery","2-Jun-12","Japan","TV-MA",6.1,"107 min","Directed by Naoyoshi Shiotani. With Atsushi Abe, Masumi Asano, Tia Lynn Ballard, Colleen Clinkenbeard. Tokyo, Winter. Despite the use of the Youth Ordinance Bill to enforce curfews for minors and regulate the use of the Internet, young people continue to fight for their own freedom through underground methods. One such group calls themselves Surat. They have decided to take on Fumito Nanahara, a man who has great influence on the political world, and basically controls Tokyo with an iron fist. ...","Atsushi Abe|Masumi Asano|Tia Lynn Ballard|Colleen Clinkenbeard|Justin Cook|Keiji Fujiwara|Misato Fukuen|Todd Haberkorn|Martha Harms|Robert McCollum|Mike McFarland|Miho Miyagawa|Nana Mizuki|Kenji Nojima|Jad Saxton","Japanese",,
"The Lurking Man (2017)"," Drama| Horror| Mystery| Thriller","18-Apr-17","USA",,8.4,"90 min","Directed by Jenn Page. With Maritza Brikisak, Daniel Lench, Frank Krueger, Dorian Gregory. 'Cailean' is an abusive alcoholic mother. When she dies she is offered a chance at redemption if she accepts Death's offer.","Maritza Brikisak|Daniel Lench|Frank Krueger|Dorian Gregory|Jentzen Ramirez|Chuck Saale|Joel Bryant|Carmen Pérez Røsnes|Tessa Espinola|Chloe Littlejohn|Kenny Lattimore|Jacqueline Hadden|Sarah J. Eagen|Leah Ann Cevoli|Paul Uhler","English",,
"Keeper of Darkness (2015)"," Horror| Thriller","26-Nov-15","Hong Kong",,5.9,"105 min","Directed by Nick Cheung. With Nick Cheung, Amber Kuo, Kai-Chung Cheung, Sisley Choi. Nick Cheung plays a streetwise exorcist who becomes an overnight sensation when his extraordinary exorcisms are recorded and go viral on the internet. However, this attracts not only the attention from the media but also creatures from the underworld.","Nick Cheung|Amber Kuo|Kai-Chung Cheung|Sisley Choi|Angie Cheung|Jacky Cheung|Philip Keung|Elena Kong|Kar Yan Lam|Wai-Keung Lau|Lawrence Ng|Ka-Man Tong|Olivia Yan|Siu-Chung Yip|Shawn Yue","Mandarin|Cantonese",,
"Truth (2014)"," Horror| Sci-Fi| Thriller",2014,"USA","NOT RATED",4.5,"96 min","Directed by Michael Cramer, Troy Scoughton Jr.. With William McNamara, Katyia Shurkin, Wayno Sanchez, Dyami Thomas. In response to the days following 9/11, a covert government agency funds a black book project to develop a live virus, Nano-Technology based truth serum. Nanotrack Industries successfully develops Veritas PVH 13 and although it produces psychological anomalies in some subjects, this chemical crowbar permanently removes a subjects ability to deceive. Large scale testing on enemy detainees in a ...","William McNamara|Katyia Shurkin|Wayno Sanchez|Dyami Thomas|Neko Sparks|Robert Dean|Johnny Tabor|Sabrina Gomez|Marcelle Bowman|Bob Singer|Jack Lutz|Eric Young|Kevin Friesen|Jon Tabor|Kenneth McGlothin","English","Silver City, New Mexico, USA",
"Skull Forest (2012)"," Action| Adventure| Horror| Thriller","9-Jun-12","USA",,2.9,"74 min","Directed by Len Kabasinski. With Brian Anthony, Brian Arrington, Luc Bernier, Sara Brooks. Four female friends embark on a weekend camping expedition into the woods. Things go horribly awry when the quartet runs afoul of a group of wicked rich folks who enjoy hunting humans for sport. Will any of these ladies make it out of the forest alive?","Brian Anthony|Brian Arrington|Luc Bernier|Sara Brooks|Steve Brown|Bud Crandall|Bob Dobiesz|James Scott Charles Howells|Len Kabasinski|Mark Kosobucki|Lisa Neeld|K.K. Ryder|Jeremiah Salhoff|Melissa Scott|William Sjolinder","English","Erie, Pennsylvania, USA",
"Voices from the Grave (2014)"," Horror","31-Aug-14","USA",,4.1,"87 min","Directed by Laurence Holloway, Richard Stoudt. With Chris Labadie, Michael Hanelin, David Nelson, Scarlett O'Neil. The dead have stories to tell a horror fan seeking the obscure.","Chris Labadie|Michael Hanelin|David Nelson|Scarlett O'Neil|Maryam Cné|Michelle Green|Bobby Shook|Sean Ryan McBride|James Leatherman|Brandon Thomas|Sarah Masters|Corey Livingston|Scarlet Fry|David C. Hayes|Stephen Kessen","English",,"$10,000 "
"Souleater (2017)"," Horror","17-Jan-17","USA",,6.1,,"Directed by Michael Lang. With Tony Armer, Johnathan Ball, Loren Blackwell, Joe Davison. In a small Florida town, the inhabitants are mysteriously disappearing. A hard core biker arrives in search of his missing daughter. He learns that a malignant force from another dimension, a Souleater, is causing the disappearances. He teams up with a burned-out sheriff and a defrocked priest to battle the creature and its zombie-like minions.","Tony Armer|Johnathan Ball|Loren Blackwell|Joe Davison|Peter Hooten|Wendi Hughes|Brian Kahrs|Don Knight|David Koepfinger|Desilyn McKeage|Gavin Roache|Thomas Noel Smith|Nathan Stevic|Kerri Stringer|Kelly Sullivan","English",,"$100,000 "
"Fantasma (2017)"," Horror| Thriller","1-May-17","USA",,7.6,,"Directed by Brett Mullen. With Caroline Williams, Kendra Carelli, Debbie Rochon, Brett Wagner. When a beautiful ballerina dancer, Adriana Mena (Kendra Carelli), lands the lead role in the upcoming Nutcracker performance, she's forced to face her demons as jealousy and tension begin to provoke the supernatural.","Caroline Williams|Kendra Carelli|Debbie Rochon|Brett Wagner|Susanne Marie Danger|Katie Carpenter|David Schifter|Tom Gore|Patrick G. Keenan|Jae Hitch|Jess Barbour|Rob Springer|Tina Reynolds|Shane Terry|Tatiana Russell","English","Richmond, Virginia, USA",
"Hell's Caretaker (2013)"," Horror| Thriller","28-Jul-13","USA",,4.2,"75 min","Directed by Philip Cappello. With Aya Beldi, Lauren Cano Zambrano, Sean Deblat, Leon Kirkland. First he took care of the house; then he took care of the people.","Aya Beldi|Lauren Cano Zambrano|Sean Deblat|Leon Kirkland|Jodi Lin|Patrick T. McGowan|Alexandra Mingione|Joey Mintz|Ian Schulz","English","Vermont, USA","$25,000 "
"Locked (2013)"," Horror| Thriller","1-Feb-13","USA",,8.8,"95 min","Directed by Eddie Lee Henderson. With Ruthie Austin, Trevor Ayala, Thomas Graham, Cameron Inman. A high school teen works at a mental hospital and hears, from a patient, of a mysterious lake house. He invites his other high school friends to party at the house. Things go from bad to worse when strange things start happening and they find out that they are trapped.","Ruthie Austin|Trevor Ayala|Thomas Graham|Cameron Inman|Corbyn Lowe|Forestt Randall|Nate Batie Scott|Matt Socia|Andrew Thomas|Haileigh Todd|Jill Waterston","English","Texas, USA",
"Amityville Creation (2017)"," Horror",2017,"USA",,,,"With Donna Hamblin, Luc Bernier, Alaina Zelch.","Donna Hamblin|Luc Bernier|Alaina Zelch","English",,
"Dead Woman's Hollow (2013)"," Crime| Drama| Horror| Romance| Thriller","24-Sep-13","USA",,5.3,"106 min","Directed by Libby McDermott. With Jeremy Bingaman, Bethany Coyle, Roger Durga Dahal, Charles Dawson. Based on a shocking true crime that took place on the Appalachian trail. Two female students set off for a camping trip into the Pennsylvania woods - but they are hunted, shot and left for dead by a mountain man after he discovers they are lesbians. A local sheriff soon begins to piece together more unsolved disappearances and murders on the trail, but can he act in time to stop more killings.","Jeremy Bingaman|Bethany Coyle|Roger Durga Dahal|Charles Dawson|Charles Dawson|Suzi Delarnoux|Koran Dunbar|Boyd Dunson|Monique Dupree|Bernardo Gomez-Kling|Christy Green|Mel Heflin|Maura Housley|Shane Huckle|Grace Kober","English",,
"Horrorween (2011)"," Comedy| Horror","26-Oct-12","USA",,5.6,,"Directed by Joe Estevez. With Jenna Jameson, William Shatner, Jay Thomas, Donald J. Trump. Some young entrepreneurs strike it rich and then move into a high class neighborhood. They try to impress their new celebrity neighbors by having a haunted house.","Jenna Jameson|William Shatner|Jay Thomas|Donald J. Trump|Tom Savini|Stuart Charno|Bill Daily|Lloyd Kaufman|Kathy Garver|Victoria De Mare|Joe Estevez|Flavor Flav|Robert Easton|Chuck McCann|R.A. Mihailoff","English","Burbank, California, USA","$10,000,000 "
"Theatre of Fear (2014)"," Horror","25-Mar-15","USA","NOT RATED",3.9,"90 min","Directed by Andrew Jones. With Jared Morgan, Lee Bane, Nathan Head, Sam Harding. The Moreau Family travel around the UK putting on an underground variety show for an adult audience. But behind the curtain there is something more sinister going on than simple entertainment.","Jared Morgan|Lee Bane|Nathan Head|Sam Harding|Shireen Ashton|Kevin Horsham|Sarah Louise Madison|Tiffany Ceri|Scott Suter|Kris Fisher|Nigel Streeter|Victor Ptak|Linda Bailey|Ritchie Bessant|Kenton Hall","English","Wales, UK",
"Grave Secrets (2013)"," Drama| Family| Horror","6-Oct-13","USA",,7.9,"75 min","Directed by David Hillenbrand. With Diane Ladd, Jennifer Stone, Kevin Brief, Christine-Olive Dobard.","Diane Ladd|Jennifer Stone|Kevin Brief|Christine-Olive Dobard|Devin Eash|Valerie Jean Garduno|Taylar Hender|Ashley Jones|Grace Kaufman|Christian Jules Le Blanc|Devan Leos|Lauren Perez|Jadon Sand|Tiger Darrien Blue Skylar|Mackenzie Brooke Smith","English","Western Heights, Los Angeles, California, USA","$1,000,000 "
"Conjoined (2013)"," Horror","27-Sep-13","USA","NOT RATED",6.4,"77 min","Directed by Joe Grisaffi. With Tom Long, Michelle Ellen Jones, Keefer Barlow, Jake Byrd. Award winning horror comedy A lonely man. An internet romance. A house with no doors. When a lonely man finds out the love of his life has a conjoined twin, who happens to be a serial killer, he must take drastic measures to keep his love life intact while keeping himself out of big trouble.","Tom Long|Michelle Ellen Jones|Keefer Barlow|Jake Byrd|Deidre Stephens|Sara Gaston|Nick W. Nicholson|Larry Wade Carrell|Derek Huey|Troy Parker|Stefan Lopez|Dan Braverman","English","Houston, Texas, USA",
"The Laughing Mask (2014)"," Crime| Horror| Thriller","31-Oct-14","USA",,6.9,"101 min","Directed by Michael Aguiar. With Floyd Adams, Arisia Aguiar, Jade Aguiar, Bill Asbury. If you're guilty, beware The Laughing Mask. Jake Johnson lost his wife and child to a psychotic killer known as Laughing Mask and goes to extreme measures to achieve his revenge.","Floyd Adams|Arisia Aguiar|Jade Aguiar|Bill Asbury|Laura Bush|Liz M. Day|Miguel AngeloTorres Diaz|Manny Dortanieves|Anthony Giovanni Elias|Flavia Falquetti|Jason Fusco|Matt Ganey|Brent 'Clutch' Gaubatz|John Hardy|Jeffrey Gwyn Jenkins","English","Orlando, Florida, USA",
"Afterparty (2013)"," Horror","13-Sep-13","Spain",,3.8,"78 min","Directed by Miguel Larraya. With Luis Fernández, Alicia Sanz, Rocío León, Ana Caldas. Carlos, an ageing teen idol, attends a wild house party filled with alcohol, drugs and sex. Nursing a hangover the next morning, he quickly realizes he is not alone in the strange house, and he may never be able to leave.","Luis Fernández|Alicia Sanz|Rocío León|Ana Caldas|Juan Blanco|Andrea Dueso|David Seijo|Úrsula Corberó|Eva Ugarte|Coté Soler|Cristina Abad|Ana Aparicio|Lukasz Arkadiusz|Carmela Azzolina|Najatt Bint","Spanish","Madrid, Spain","  €2,800,000  "
"Kubot: The Aswang Chronicles 2 (2014)"," Action| Comedy| Horror","22-Apr-15","Cambodia",,7.4,"105 min","Directed by Erik Matti. With Dingdong Dantes, Abra, Ku Aquino, Ramon Bautista. A family of bloodthirsty monsters descends on the city to take revenge on the man that caused the death of so many of their own.","Dingdong Dantes|Abra|Ku Aquino|Ramon Bautista|Isabelle Daza|Lotlot De Leon|Marco Ho|Joey Marquez|KC Montero|Elizabeth Oropesa|Jun Sabayton|Julie Anne San Jose|Jeron Teng","Filipino|Tagalog",,
"Crone Wood (2016)"," Horror| Thriller","30-Oct-16","Ireland",,7.5,"86 min","Directed by Mark Sheridan. With Elva Trill, Ed Murphy, Sarah Jane Seymour, Karen McCartney. A young couple who just met decides to go camping after a wonderful first encounter, a decision they will soon regret.","Elva Trill|Ed Murphy|Sarah Jane Seymour|Karen McCartney|Stephen Doring|Saoirse Doyle|Rowan Finken|Degnan Geraghty|Meg Healy|Geraldine McAlinden|Esther Woods","English","Crone Wood, Ireland",
"Survival Instinct (2016)"," Action| Horror| Thriller","13-Jun-16","UK",,3.2,"75 min","Directed by Steve Lawson. With Andrew Coughlan, Helen Crevel, Isabella Nash, Glenn Salvage. Taking its cue from classic survival-thrillers such as 'Duel' and 'Deliverance', 'Survival Instinct' is a fast-paced edge-of-your seat thriller with a strong female lead and a plausible, morally-ambiguous villain.","Andrew Coughlan|Helen Crevel|Isabella Nash|Glenn Salvage|Sam Smith|Jay Sutherland","English",,
"Aadupuliyattam (2016)"," Horror","20-May-16","India",,4.2,"145 min","Directed by Kannan Thamarakkulam. With Jayaram, Ramya Krishnan, Om Puri, Akshara Kishor. King Udayapandyan ruled some provinces of Tamil Nadu, 600 years ago. He fell in love with a huntress named Mathangi (Ramya Krishnan), married her and built her a bungalow near the forest. When Udayapandyan is defeated in a war, he takes shelter at Mathangi's bungalow and she vows to take care of the king. She sacrifices her life before the deity Bhadrakali, to save the life of King Udayapandyan. ...","Jayaram|Ramya Krishnan|Om Puri|Akshara Kishor|Sheelu Abraham|Pradeep Kottayam|Valsala Menon|Veena Nair|Saju Navodaya|Ramesh Pisharody|Sampath Raj|Siddique|S.P. Sreekumar|Antony Thekkek","Malayalam|Malayalam|Hindi|Tamil|Telugu","Palani, Tamil Nadu, India",
"Big Bad Bugs (2012)"," Action| Adventure| Comedy| Horror| Sci-Fi| Thriller","29-Dec-12","Russia",,2.2,"95 min","Directed by Peter Paul Basler. With Jack Plotnick, Sarah Lieving, Ted Jonas, Camden Toy. After a convoy of American soldiers disappears, a special ops team is deployed to rescue them. They soon encounter an army of gigantic scorpions, spiders and snakes that have come to Earth from another dimension.","Jack Plotnick|Sarah Lieving|Ted Jonas|Camden Toy|Bo Kane|Devon Ogden|Randy Clark|Kris Wheeler|Steve Silverie|Tyler McGee|Andre Tenerelli|Michael Monks|Don Williams|Kenny Lombino|Carmen Thomas","English","Los Angeles, California, USA","$1,000,000 "
"White Raven (2015)"," Adventure| Drama| Horror| Thriller","23-May-17","Canada","NOT RATED",5.3,"94 min","Directed by Andrew Moxham. With Steve Bradley, Aaron Brooks, Cindy Busby, Missy Cross. Four men head into the remote woods on an annual camping trip. As one of them gradually loses his mind, the weekend of fun takes a turn for the worse and the other three must fight for their lives.","Steve Bradley|Aaron Brooks|Cindy Busby|Missy Cross|Andrew Dunbar|Catherine Michaud|Sarah Smyth|Shane Twerdun|Preston Vanderslice","English",,
"Videoclub (2013)"," Action| Horror| Romance","30-Jan-14","Chile",,4.9,,"Directed by Pablo Illanes. With Pedro Campos, Luciana Echeverría, Francisca Díaz, Samuel González. In 1992, a young man who works at a video store takes shelter in it (along with his friends and family) during a ""possible"" zombie invasion.","Pedro Campos|Luciana Echeverría|Francisca Díaz|Samuel González|Berta Lasala|Daniel Alcaíno|Ingrid Cruz|Eyal Meyer|Cristobal Tapia Montt|Marcelina Acevedo|Soledad Acevedo|Sebastián Layseca|Felipe Ríos|Carmen Gloria Bresky|Gonzalo Muñoz-Lerner","Spanish","Ñuñoa, Santiago, Chile",
"Sebastian (2011)"," Action| Horror| Mystery","14-Apr-12","USA",,4.9,"108 min","Directed by Gregori J. Martin. With Daeg Faerch, Meadow Williams, Betsy Rue, Greg Vaughan. Miranda Barnes (brilliantly played by Meadow Williams) is a tragic yet gallant figure. Stunning events rapidly awaken strength and spiritual awareness essential for her survival. Daeg Faerch gives an outstanding performance as Sebastian. Is he an angel sent from God or a psychopathic serial killer. Dee Wallace gives a captivating performance as Barbara Sample as she reveals veiled secrets as to ...","Daeg Faerch|Meadow Williams|Betsy Rue|Greg Vaughan|Dee Wallace|Meg Foster|Brody Hutzler|Joe Estevez|Caroline Williams|Kym Whitley|Andre Boyer|Michael Brainard|Kira Brannlund|Brock Cuchna|Vincent De Paul","English",,
"Safe Inside (2017)"," Horror","21-Jun-17","USA",,5,"91 min","Directed by Jason Paul Collum. With Christopher D. Harder, Brinke Stevens, Judith O'Dea, Darcey Vanderhoef. One hot summer night, JJ Tyler thinks he's spending the night alone in his suicidal mother's home. He's wrong.","Christopher D. Harder|Brinke Stevens|Judith O'Dea|Darcey Vanderhoef|Tina Ona Paukstelis|Karen Dilloo|Keith McLeod|Jerod Howard|Frank Anderson|Josh Greytak|Kyle McLeod|Doug Despin|Brian Vanderhoef|Sy Stevens|Alicia Smith","English","Racine, Wisconsin, USA",
"Predatory Moon (2017)"," Horror","1-Oct-17","USA",,,"90 min","Directed by Shiva Rodriguez. With Christopher Morrissey, Jonathan Foster, D. Duckie Rodriguez, Tracy Anderson. Kyle Reading is a zoologist who has been studying wild animal attacks across the country in hopes of finding ways to prevent them. When a young boy is allegedly killed by a bear in Florida, Kyle launches his own investigation. He quickly turns his attention to Dean Clout, the child's uncle, who somehow survived the vicious attack. Dean, infamous for being the town drunk, remembers very little ...","Christopher Morrissey|Jonathan Foster|D. Duckie Rodriguez|Tracy Anderson|Lowrie Fawley|Jeffrey Crisp|Mel Heflin|Kathleen O'Brien|Gregory Lee Cason|Mike Cornell|LeNelle Hartner-Stephens|Alexander Brousseau|Bob Glazier|Sally Drews|Skip Klavans","English","Ormond Beach, Florida, USA","$25,000 "
"Amnesiac (2013)"," Drama| Horror| Thriller","1-Mar-13","UK","TV-MA",3,"90 min","Directed by Martin Rutley. With Gemma Deerfield, Leon Florentine, Katya Greer, Edwina Lea. A blend of supernatural horror and psychological drama, Wyke Wreake counts the cost of loss, guilt and reckless desperation as we delve into the life of one deeply disturbed young woman and the afterlife of one equally disturbed dead man.","Gemma Deerfield|Leon Florentine|Katya Greer|Edwina Lea|James Marsh|Jon Stoley","English",,
"The Biker Warrior Babe vs. The Zombie Babies from Hell (2014)"," Horror","1-Nov-14","USA","TV-MA",3.6,"79 min","Directed by Jeremiah Morehouse. With Candi Achibald, Kaza Marie Ayersman, Caitlin Bentley, Nathan Bingman. A botched demon summoning causes three friends to become the de facto saviors of their hometown, Cranberry Lake. It's a race against time to correct the ritual before a legion of demonic zombie babies eat everyone in town.","Candi Achibald|Kaza Marie Ayersman|Caitlin Bentley|Nathan Bingman|Michael Black|Jessica Bloom|Matt Brissette|Dallas Coulter|Sally Coventry|Nigel Daniel|Heather Davidson|Brii Davis|Jake Dylman|Elise Eden|Ryan E. Francis","English","Heath, Ohio, USA","$10,000 "
"Münafik (2015)"," Drama| Horror| Thriller","3-Apr-15","Turkey",,4.8,,"Directed by Ozkan Aksular. With Özer Arslan, Murat Bulent Atacan, Balim Gaye Bayrak, Karina Malsagova. In 1984, Valeria, who has worked for one of the ESP laboratories, which works on investigating parapsychological phenomena in Soviet Union, comes to Turkey by invitation of her ex-lover for the purpose of making a research related to a woman known as ""Nazife the Possessed"". Working in the village Nalbant, in Azdavay, Kastamonu. Carrying on her research, Valeria suddenly vanishes without a trace. ...","Özer Arslan|Murat Bulent Atacan|Balim Gaye Bayrak|Karina Malsagova|Zeynep Okan|Nalan Olcayalp|Ahmet Fuat Onan|Hakan Salinmis|Erdogan Sicak|Gülriz Sirinyan|Levent Sülün","Turkish","Istanbul, Turkey",
"Bloody Snow (2016)"," Horror","25-Aug-16","USA",,3.2,"61 min","Directed by Desmon Heck. With Monique Giselle, Chris Nelson, Desmon Heck, Matt Schulte. Sara Snow, an awkwardly lonely and nervous girl, is being targeted by a serial killer whose thirst for death cannot be quenched.","Monique Giselle|Chris Nelson|Desmon Heck|Matt Schulte|Sam Wiegers|Chara Burgh|Lydia Castro|Kristen DeLuca|Ben Crowley|Kristine Kay Kelly|Ryan T. Husk|Chris Prascus|Meghan Keeler|Michael John Lane|Rachel Matisoff","English",,
"Awaiting (2015)"," Drama| Horror| Thriller","1-Mar-15","Portugal",,4.7,"95 min","Directed by Mark Murphy. With Tony Curran, Diana Vickers, Rupert Hill, Peter Woodward. Deep in the English moors, a sociopath preys on innocent people, until one day his secrets are finally revealed and an inevitable confrontation is at hand.","Tony Curran|Diana Vickers|Rupert Hill|Peter Woodward|Adrian Bouchet|Charley Mcdougall|Sophie Lovell Anderson","English","York, North Yorkshire, England, UK","$3,000,000 "
"Tin Can Man (2007)"," Horror","1-Mar-12","Ireland","NOT RATED",6.5,,"Directed by Ivan Kavanagh. With Patrick O'Donnell, Michael Parle, Emma Eliza Regan, Kreeta Taponen. Recently dumped by his girlfriend for another man, working in a job he hates, things could be better for Peter. One night, while he is alone in his apartment, there is a knock at the door. His life will never be the same again.","Patrick O'Donnell|Michael Parle|Emma Eliza Regan|Kreeta Taponen","English",,"  €10,000  "
"Die Die Delta Pi (2013)"," Horror","21-Jun-13","USA","UNRATED",4.2,"78 min","Directed by Sean Donohue, Christopher Leto. With Aaron Quick Nelson, Krystal Pixie Adams, Andrea Alfonso, Bianca Allaine. In the 1980's, a group of sorority girls pull a prank on a fellow Sister out of envy, which results in her being burned to death. But did she really die, or is she still seeking revenge?","Aaron Quick Nelson|Krystal Pixie Adams|Andrea Alfonso|Bianca Allaine|Vincent Anthony|Kristin Avery|Kyle Ayala|Lexi Balestrieri|Christine Bell|Olivia Blake|Raven Blakkwell|Keisha Burchard|Shade Burnett|Nick Canning|Colin Carney","English","Tampa, Florida, USA","$7,000 "
"Return to Blood Fart Lake (2012)"," Horror","21-Feb-12","USA","NOT RATED",4.5,"72 min","Directed by Chris Seaver. With Jesse Ames, Andrew Baltes, Billy Garberina, Bobby Hartsfield. Many years have passed since the tragic events at Blood Fart Lake, where Jimmy dispatched a bunch of party going, cabin dwelling kids before he could be stopped by Ben Scrivens & his red neck pal, Leo Dechamp. Now Jimmy has returned, this time preying on a group of ""Spirit Hunters"" searching for the truth to his killings, & Ben must track down Leo before they're added to his list of victims!","Jesse Ames|Andrew Baltes|Billy Garberina|Bobby Hartsfield|Meredith Host|Jason McCall|Chris Seaver|Trevor Smith|Josh Suire|Lauren Van Deroef|Whitney VanHorn|Clark Westfield","English",,"$3,000 "
"Art School of Horrors (2015)"," Comedy| Horror","29-Oct-15","USA",,6.8,,"Directed by Thijs Bazelmans. With Sarah Rose Butler, Jeffrey Combs, Zach Eulberg, Connie Foster.","Sarah Rose Butler|Jeffrey Combs|Zach Eulberg|Connie Foster|Durand Garcia|Michael Grayson|Camille Grenier|Mark Haptonstall|Matthew Jacobs|Jeremy Jones|Kenny Leu|Arielle Mandelberg|Charlie Max|Sean McQueen|Alejandro Morales","English","San Francisco, California, USA",
